product_category,product_url,review_date,Date,handle,rating,helpfulness_rating,review
disposable_gloves,https://www.amazon.com/dp/B07KYV178H,2/4/2021,Post_Covid,Peter,3,,"the size is small, the quality is ok, I prefer to buy from target."
disposable_gloves,https://www.amazon.com/dp/B07KYV178H,12/1/2020,Post_Covid,Tim,1,,The sizes are incorrect
disposable_gloves,https://www.amazon.com/dp/B07KYV178H,4/2/2020,Post_Covid,DL,1,4,The tear going on. Bad product.
disposable_gloves,https://www.amazon.com/dp/B07KYV178H,11/11/2020,Post_Covid,jim gill,2,,their size MEDIUM will not work for the same hands that fit other suppliers medium. order one size up for correct fit unless you like your gloves to fit condom tight
disposable_gloves,https://www.amazon.com/dp/B07KYV178H,1/29/2021,Post_Covid,A.Battles,3,,"There hard to put on even when you hands are smaller, break easily.  Not flexible."
disposable_gloves,https://www.amazon.com/dp/B07KYV178H,10/17/2020,Post_Covid,Sarah Who,1,One,"There is NO stretch to them at all!  If you have medium sized hands, if you HAVE to order them, order large or your hand will either barely fit or not at all!  I ordered a few boxes and now stuck with them until I run out!  VERY disappointed!"
disposable_gloves,https://www.amazon.com/dp/B07KYV178H,7/13/2020,Post_Covid,Karla Williams,5,,There is nothing I dislike about this product.
disposable_gloves,https://www.amazon.com/dp/B07KYV178H,9/27/2020,Post_Covid,Jody,5,,There vinyl so they arent great but will work in a pinch.
disposable_gloves,https://www.amazon.com/dp/B07KYV178H,2/12/2021,Post_Covid,Gaildc,1,,"There’s a reason these are cheap. The nitrile gloves I normally order were unavailable and I needed a substitute. Generally I trust the “Amazon Choice” designation but in this case, it failed me. These are thin, easily torn, and almost impossible to pull all the way onto the fingers without damaging the glove. If a price seems too good to be true, it probably is. These gloves support that theory."
disposable_gloves,https://www.amazon.com/dp/B07KYV178H,7/18/2020,Post_Covid,LO,2,,These are a lot smaller than expected for a medium and rather tedious to get into.  Will probably never use them.
disposable_gloves,https://www.amazon.com/dp/B07KYV178H,11/5/2020,Post_Covid,Shannen,1,,These are awful. Your hands will sweat profusely and they rip easily. I'm using them when I clean or during food prep just to get some use out if the box but I will never purchase them again.
disposable_gloves,https://www.amazon.com/dp/B07KYV178H,3/2/2021,Post_Covid,Raylo1313,2,,These are bad for home care of my elderly spouse.  They don’t stretch and tear easily.
disposable_gloves,https://www.amazon.com/dp/B07KYV178H,4/5/2020,Post_Covid,C.,5,,These are decent medium weight gloves. Great for General protection in these days of Coronavirus. Also really good for light cleaning.
disposable_gloves,https://www.amazon.com/dp/B07KYV178H,5/9/2020,Post_Covid,Fortune Charter,5,,These are disposable gloves I have used them for groceries shopping during covid 19 so use only once
disposable_gloves,https://www.amazon.com/dp/B07KYV178H,4/20/2021,Post_Covid,tonkatoi,5,,These are exactly what I thought they would be.  Works great for painting and cleaning.
disposable_gloves,https://www.amazon.com/dp/B07KYV178H,1/23/2021,Post_Covid,Arlene,5,,These are exactly what I wanted for trips to the supermarket and big box stores. I have ordered these twice and recommend them. The medium size fits me perfectly and they’re easy to put on and remove.
disposable_gloves,https://www.amazon.com/dp/B07KYV178H,4/1/2021,Post_Covid,jia casillas,5,,These are good for household use. Great for those with latex and powder allergies. These are vinyl so not much stretch
disposable_gloves,https://www.amazon.com/dp/B07KYV178H,2/12/2021,Post_Covid,jean,5,,These are good gloves.  Every once in a while one will rip near the wrist when I put them on or take them off but overall the are durable and a good value.
disposable_gloves,https://www.amazon.com/dp/B07KYV178H,3/6/2021,Post_Covid,me12ny,5,,these are great
disposable_gloves,https://www.amazon.com/dp/B07KYV178H,1/8/2021,Post_Covid,Nicnok,5,,These are great foods safe use them for everythig when I don't want to wash my hands.
disposable_gloves,https://www.amazon.com/dp/B07KYV178H,4/24/2021,Post_Covid,Amazon Customer,5,,"These are great, i use them for cleaning or cooking and they do great . They might get cut a little here and there if you wear them too long or while using a knife  but other than that they're pretty good."
disposable_gloves,https://www.amazon.com/dp/B07KYV178H,5/23/2020,Post_Covid,hotwheels,5,,"These are great. I will purchase again during COVID. They didn't leave any film or powder on my hands. Perfect for grocery store shopping and pumping gas. There are so many, that I gave a handful (with my glove and mask on) to a woman about to pump her gas. Thank you for being affordable."
disposable_gloves,https://www.amazon.com/dp/B07KYV178H,7/14/2020,Post_Covid,D Purcell,4,,"These are indeed vinyl, I bought them by mistake. I was looking for Nitrile and didn’t notice these were vinyl. They arrived in good condition and as described."
disposable_gloves,https://www.amazon.com/dp/B07KYV178H,7/11/2020,Post_Covid,Jonathan Alveno,3,2,These are kinda crappy but good enough for one time use at a grocery store or public restroom
disposable_gloves,https://www.amazon.com/dp/B07KYV178H,2/3/2021,Post_Covid,MrsH,5,,These are more durable than other brands I have purchased.
disposable_gloves,https://www.amazon.com/dp/B07KYV178H,9/2/2020,Post_Covid,DLux,3,,"These are more like food handler gloves (thin); my box had about 5 defective or stained gloves in it (had holes or were discolored brownish orange stained).  If your hand has any moisture on it, it is VERY hard to get them on.  The bottom of the glove had torn several times while we were trying to put them on.  If your using them to cook, they should be okay but if you need to wear them out... get a different kind."
disposable_gloves,https://www.amazon.com/dp/B07KYV178H,12/4/2020,Post_Covid,MR XBOX HIMSELF,1,One,These are not those stretchy medical gloves you can pull and snap on. Like you see in movies where the Doctor pulls the glove down the wrist and it snaps back. NOPE NOT THESE. If you even give these the slightest pull they break. I've put on about 15 of them and all of them broke at the wrist trying to get them on. Rip Way to Easily. Waste your money somewhere else.
disposable_gloves,https://www.amazon.com/dp/B07KYV178H,2/23/2021,Post_Covid,Cmpg,5,,These are perfect for keeping hands clean . They are heavy enough so they don’t fray. I’ve ordered three times snd no problem. Also they don’t smell like many others do!
disposable_gloves,https://www.amazon.com/dp/B07KYV178H,1/20/2021,Post_Covid,Cate,4,,"These are practical for simple medical tasks at home. They do tear easily especially around the wrist.  They fit me well. One must be careful if rising or water will enter the glove, thus, often requiring a new glove.  Don’t buy them for heavy toil. They won’t hold up to such a task. Good quantity."
disposable_gloves,https://www.amazon.com/dp/B07KYV178H,9/28/2020,Post_Covid,Mike Roberts,3,,These are super super thin. when I am staining wood I have to wear two on each hand. It was all I could get when everybody was selling out of them because of the virus but I won't buy them again
disposable_gloves,https://www.amazon.com/dp/B07KYV178H,7/11/2020,Post_Covid,Jewels,1,2,These are terrible. Rip when putting on. Felt so thin on skin. Do not waste any money on these.
disposable_gloves,https://www.amazon.com/dp/B07KYV178H,4/6/2020,Post_Covid,Judith Game,5,,These are the best for the price
disposable_gloves,https://www.amazon.com/dp/B07KYV178H,1/29/2021,Post_Covid,Sraker,2,,These are to thin and break when you put them on!
disposable_gloves,https://www.amazon.com/dp/B07KYV178H,1/7/2021,Post_Covid,Brandon James,3,,"These are typical vinyl gloves and are perfectly adequate for the usual things that do not require sterility - these are not sterile. Vinyl has its limitations compared to nitrile such as less resiliency and less chemical resistance (acetone and certain other solvents will dissolve these) but it keeps my hands clean and, most important, it's actually available unlike nitrile."
disposable_gloves,https://www.amazon.com/dp/B07KYV178H,9/16/2020,Post_Covid,Kandelina,1,One,"These are very cheap gloves, they rip as you are putting them on and if you have finger nails (normal, nothing extravagant) they will rip through the holes. I bought them for my soap making and keeping everything sanitary but these are so thin, it isn’t worth it. I just bought a box of nitrile gloves that Ive used before and they are much tougher. I should have just stuck with those since the price is comparable. Now I have a box of gloves that can’t be used. The size isn’t true to fit either, hence the ripping when trying to get them on. Got a medium which my hand fits fine in other brands and these are probably best for small hands."
disposable_gloves,https://www.amazon.com/dp/B07KYV178H,3/20/2021,Post_Covid,D. Goldberg,5,,These are very good for single use personal care.
disposable_gloves,https://www.amazon.com/dp/B07KYV178H,12/15/2020,Post_Covid,laconfidential,4,,"These are very well made gloves. However, they run very, very small. I ordered medium and could barely get them on. I had to stretch them to make the fit. Make sure you get a size (or two ) larger."
disposable_gloves,https://www.amazon.com/dp/B07KYV178H,9/15/2020,Post_Covid,KG,2,,These break very easily at the wrist! Worthless when it comes to caring for my boyfriend post surgery.
disposable_gloves,https://www.amazon.com/dp/B07KYV178H,12/15/2020,Post_Covid,judy craft,5,,These disposable gloves do exactly what they are meant to do. The important thing is to make sure you use them only one time and then dispose of them
disposable_gloves,https://www.amazon.com/dp/B07KYV178H,12/7/2020,Post_Covid,Sharon E. Caldwell,5,,"These fit better than any I've tried! The thickness is great - I use them for cleaning, taking care of garbage- just to mention a couple of jobs I use them for. Great value for the money!"
disposable_gloves,https://www.amazon.com/dp/B07KYV178H,3/18/2021,Post_Covid,Jami Lyn,5,,These gloves are  what  I had expected...I use for work  as well as at home sometimes . I am happy with this purchase .
disposable_gloves,https://www.amazon.com/dp/B07KYV178H,12/9/2020,Post_Covid,Constance Hayes,3,,"these gloves are a big disappointment they are not pliable and therefore, rip when trying to put them on--i will not be purchasing these again!"
disposable_gloves,https://www.amazon.com/dp/B07KYV178H,8/31/2020,Post_Covid,Number37,5,,"These gloves are a bit thicker and therefore sturdier, and fit much better than the gloves I've been using. Like these a lot!"
disposable_gloves,https://www.amazon.com/dp/B07KYV178H,12/30/2020,Post_Covid,sc,3,,"These gloves are a lot thinner then what I expected. I was putting them on and the rim torn very easily not too mention they seem to run a little smaller. I have used others size medium put them.on with no difficulties and with these I struggled  a little.  What I did like, there was no powdered residue."
disposable_gloves,https://www.amazon.com/dp/B07KYV178H,1/5/2021,Post_Covid,Jeanie,5,,These gloves are adequate. The prices have gone up on all gloves due to the pandemic but I’m glad to have them. They are thick and durable. The top rolls down a little and they do not fit snuggly. They do get the job done though!
disposable_gloves,https://www.amazon.com/dp/B07KYV178H,12/11/2020,Post_Covid,Karen R. DePalma,1,,These gloves are difficult to slip on and tend to tear very easily.
disposable_gloves,https://www.amazon.com/dp/B07KYV178H,2/2/2021,Post_Covid,Mikki Rausch,5,,"These gloves are durable and ample thickness keeps them from tearing. I am allergic to latex so these vinyl ones fill the need nicely. I use these primarily for protecting my hands from disinfectants, virus and bacteria contamination, and elderly cat incontinence cleanup."
disposable_gloves,https://www.amazon.com/dp/B07KYV178H,1/23/2021,Post_Covid,Kimberly Daniels,5,,These gloves are durable and thick enough for what I need. They are expensive but all PPE has gotten outrageous since March so no surprise there. Prior to this I could easily find gloves for $7-$9 per box.
disposable_gloves,https://www.amazon.com/dp/B07KYV178H,11/12/2020,Post_Covid,KimoPrimo,2,,"These gloves are fine if wearing a short period of time and for a simple task. Other than that they are useless. When using them to clean and wipe down products and surfaces, they tear very easily around the fingertips and knuckles. Can even feel the disinfectant (like isopropyl alcohol or lysol/clorox wipes) bleed thru onto your hands and fingers. Even if you double them. No protection."
disposable_gloves,https://www.amazon.com/dp/B07KYV178H,1/7/2021,Post_Covid,Meli S,3,,"These gloves are good for a shopping trip or painting rocks. I've tried to use the gloves for cleaning but the gloves rip easily. I now wear 2 pair at a time. A double-glove prevents tears, but you're using twice as many."
disposable_gloves,https://www.amazon.com/dp/B07KYV178H,3/29/2021,Post_Covid,jobo,5,,These gloves are great for all my uses  They are comfortable and I use them and then just toss them away
disposable_gloves,https://www.amazon.com/dp/B07KYV178H,10/20/2020,Post_Covid,Katie L,1,,These gloves are junk dont waist your money. Every glove seems to have a hole and my hands get wet.
disposable_gloves,https://www.amazon.com/dp/B07KYV178H,8/3/2020,Post_Covid,Victoria,1,,"These gloves are not durable, not flexible, and very easy to be ripped broken.  I normally wear size small but bought these gloves at size medium, but they were still very difficult to be put on or taken off.  I would rather to pay a bit more for better gloves."
disposable_gloves,https://www.amazon.com/dp/B07KYV178H,1/31/2021,Post_Covid,Lusiana,3,,"These gloves are not very thick, they do the job, but they are lose around the wrist and break easily. You have to change often. I use them for cleaning around the house."
disposable_gloves,https://www.amazon.com/dp/B07KYV178H,8/4/2020,Post_Covid,Miki,2,,These gloves are not waterproof and allow fluids to enter. Do not use with bodily fluids.
disposable_gloves,https://www.amazon.com/dp/B07KYV178H,3/27/2020,Post_Covid,Tyzuki,4,One,These gloves are ok but they aren’t as good of a quality compared to other gloves.
disposable_gloves,https://www.amazon.com/dp/B07KYV178H,9/26/2020,Post_Covid,Brenda Rice,4,One,"These gloves are on the small side, simply because they do not stretch like nitrile gloves do. However, as long as your hands are totally dry and you slip them on slowly, carefully over the fingers first, then down your hand, they go on well. My husband and adult son are not fond of them because they break when they put them on; I have found them to go on well when I take the time as mentioned above. Yes, I have had a few break on that last pull over my palm but I usually take the time to do it carefully. I ordered more because they are more readily available and a few dollars less than nitrile. I am glad I ordered the medium size though; I have nitrile gloves in small that fit my hand nicely, but these in a small would not have worked at all. So, think about the sizing, one size up, because had I known this before and ordered the XL for my husband and adult son, they might work better for them. I like them for what I need, filling the gas tank, handling certain things from the store, going through the mail; just remember to order a size larger."
disposable_gloves,https://www.amazon.com/dp/B07KYV178H,12/1/2020,Post_Covid,Diane,4,,"These gloves are on the thicker side without any “give”, and have a rolled cuff. They run a bit small. However, they do the job! Didn’t tear when I wore them."
disposable_gloves,https://www.amazon.com/dp/B07KYV178H,3/3/2021,Post_Covid,vivian K. Howton,5,,These Gloves are perfect for the cleaning solutions I use to keep my hands soft they are very durable
disposable_gloves,https://www.amazon.com/dp/B07KYV178H,2/24/2021,Post_Covid,Michael Humpal,5,,These gloves are pretty durable
disposable_gloves,https://www.amazon.com/dp/B07KYV178H,8/28/2020,Post_Covid,davie,2,,These gloves are so thin and weak that they tear when putting them on.
disposable_gloves,https://www.amazon.com/dp/B07KYV178H,12/4/2020,Post_Covid,Aimee,2,,These gloves are super thin and of poor quality. I bought them because they were a bit cheaper but I got what I paid for. Don’t buy terrible product.
disposable_gloves,https://www.amazon.com/dp/B07KYV178H,9/9/2020,Post_Covid,Wanda Brown,1,,"These gloves are terrible, too thin, not very elastic, rips between the fingers and and at the wrist. Don’t bother with these!!"
disposable_gloves,https://www.amazon.com/dp/B07KYV178H,1/6/2021,Post_Covid,Cheryl L.,1,,"These gloves are terrible.  They are easily the worst I have ever used, and I have been purchasing gloves on Amazon for several years.  I only ordered this brand because my normal choice was out of stock long term secondary to the ongoing pandemic.  These gloves are certainly not heavy duty nor medical grade, as the manufacturer claims.  They run small in size, and they frequently rip during donning.  They are barely adequate for lightweight duty and would not hold up to anything more than that.  Do not buy these if anything else at all is available."
disposable_gloves,https://www.amazon.com/dp/B07KYV178H,3/26/2021,Post_Covid,Patricia A. Williams,1,,"These gloves are the worst gloves made during this Pandemic and they should be ashamed of themselves! A medium was too small. But my hands aren't large. They didn last one dish washing! And yes, I wash my dishes, it's only me! The fingers were too short and the tips always broke. I kept them because I have skin issues and must keep my hands covered with WELL MADE GLOVES when using my hands! These were the only gloves left on the shelves. I had no choice. They offered a return but I needed something to protect my hands."
disposable_gloves,https://www.amazon.com/dp/B07KYV178H,2/1/2021,Post_Covid,K NYC,2,,These gloves are thick yet rip too easily.  I do not think I was able to use a pair without one of the gloves ripping.  Waste of money.
disposable_gloves,https://www.amazon.com/dp/B07KYV178H,5/14/2020,Post_Covid,Janis Fok,1,2,"These gloves are very poor quality and thin it breaks when I put it on.  Not nitrile gloves, not flexible."
disposable_gloves,https://www.amazon.com/dp/B07KYV178H,10/18/2020,Post_Covid,Joy Taylor Barnes,5,,These gloves are very substantial and durable which make them easy to put on or take off.
disposable_gloves,https://www.amazon.com/dp/B07KYV178H,1/10/2021,Post_Covid,Kindle Customer,1,,"These gloves are very thin and brittle. They tear very easily. I thought I had the wrong size, but bigger gloves still rip two of three times."
disposable_gloves,https://www.amazon.com/dp/B07KYV178H,3/15/2021,Post_Covid,Caree Newman,2,One,These gloves are very thin and tear quite easily. I wish they lasted longer!
disposable_gloves,https://www.amazon.com/dp/B07KYV178H,12/28/2020,Post_Covid,Nansee,2,,These gloves are very thin. They tear as I am putting them on my hands. Will never order this product again!!!
disposable_gloves,https://www.amazon.com/dp/B07KYV178H,8/9/2020,Post_Covid,Stacey Smith,2,,These gloves constantly break when I'm on the register.  Not worth buying!!
disposable_gloves,https://www.amazon.com/dp/B07KYV178H,12/8/2020,Post_Covid,Linda Hendricks,5,,"These gloves don’t seem to be as thick and the size medium. Seems to be a little snugger than the blue gloves as the blue gloves , but they get the job done."
disposable_gloves,https://www.amazon.com/dp/B07KYV178H,3/17/2021,Post_Covid,puppyfoster,5,,These gloves fit better than other gloves I have used. I foster puppies and I use these when they may be infectious.
disposable_gloves,https://www.amazon.com/dp/B07KYV178H,1/15/2021,Post_Covid,lulu,5,,These gloves fit perfectly and keep my hands protected from the air and whatever may be in the air.
disposable_gloves,https://www.amazon.com/dp/B07KYV178H,11/4/2020,Post_Covid,Gail Miccio,5,,These gloves have a more tapered fit then other gloves. The thickness is adequate and not easily punctured. A good buy and an essential purchase for Covid-19 times.
disposable_gloves,https://www.amazon.com/dp/B07KYV178H,12/30/2020,Post_Covid,Michael R. Bradley,2,,These gloves have a poor fit and tear when you pull them on. Poor quality.
disposable_gloves,https://www.amazon.com/dp/B07KYV178H,9/16/2020,Post_Covid,Yulia,1,,These gloves have a very strong chemical smell. I’m washing my hands after wearing them and can still smell it. I’ve used numerous brands of rubber gloves and never had this problem.
disposable_gloves,https://www.amazon.com/dp/B07KYV178H,12/1/2020,Post_Covid,R. Huffman,1,One,"These gloves have good reviews, but as with all things in our economic system I expect these are outsourced to different firms that have wildly divergent quality control. We bough two boxes, and the ones we got are horrible. I normally fit medium, but these are much too small. For bad sizing I would normally ding a product just a start or two. But the quality of these gloves i also terrible. My wife, who can wear them, has to be very careful not to tear them just putting them on; never mind doing actual work with them. Go ahead and buy them if you like playing roulette. But if you want a 100% guarantee you'll get decent gloves, look elsewhere."
disposable_gloves,https://www.amazon.com/dp/B07KYV178H,1/22/2021,Post_Covid,person,1,,"These gloves have no durability. I keep my nails short and smooth, but these gloves still rip at the fingernail, at the knuckles, and between the fingers with the most minor activities. They are entirely useless."
disposable_gloves,https://www.amazon.com/dp/B07KYV178H,1/20/2021,Post_Covid,KAYLA,5,,These gloves Re comfortable and they are durable.
disposable_gloves,https://www.amazon.com/dp/B07KYV178H,3/31/2020,Post_Covid,T. harm,1,6,These gloves rip as soon as you put them on.  Very poor quality.
disposable_gloves,https://www.amazon.com/dp/B07KYV178H,1/31/2021,Post_Covid,Lindsay,1,,These gloves rip as soon as you put them on. They are definitely not worth the money. They are garbage.
disposable_gloves,https://www.amazon.com/dp/B07KYV178H,11/14/2020,Post_Covid,Jazzy Stone,1,,These gloves rip before I can even get them on. I don't have long nails and I tried being gentle with them but the always tear when I try yo put them on... Absolute waste.
disposable_gloves,https://www.amazon.com/dp/B07KYV178H,8/7/2020,Post_Covid,MDAVS,2,,"These gloves rip every time I put them on at the wrist. I mainly use them in the house to throw out garbage or clean bathroom, etc."
disposable_gloves,https://www.amazon.com/dp/B07KYV178H,12/5/2020,Post_Covid,maybeillflytoday,2,,These gloves rip extremely easily. I’m shocked that they say “medical exam gloves” 😬
disposable_gloves,https://www.amazon.com/dp/B07KYV178H,10/26/2020,Post_Covid,Cindy,3,,These gloves rip too easily as you're trying to put them on especially towards the cuff of the gloves.  Not worth buying.
disposable_gloves,https://www.amazon.com/dp/B07KYV178H,1/28/2021,Post_Covid,Rach,1,,These gloves rip very easily These gloves are small for medium size Not a good deal
disposable_gloves,https://www.amazon.com/dp/B07KYV178H,3/29/2020,Post_Covid,Judith M.,3,,These gloves run small ...my ring size is 4.5 and they fit me but tightly
disposable_gloves,https://www.amazon.com/dp/B07KYV178H,2/16/2021,Post_Covid,Timothy R. Brannon,2,,These gloves run small.  If you ware a medium in a fairly quality glove you better order a large.  They are thin so they tear easily.
disposable_gloves,https://www.amazon.com/dp/B07KYV178H,4/1/2020,Post_Covid,CYar,2,,"These gloves run small. Wouldn't fit me or my husband, we have always fit a medium with no issues. I have a hard time getting these on as they are smaller than most, really tight. Had to order others as we can't use these."
disposable_gloves,https://www.amazon.com/dp/B07KYV178H,10/18/2020,Post_Covid,Paula,5,,"These gloves seem very good for protection of hands and for protection from surface microbes. They fit a bit tight, but perhaps the medium is a bit smaller than some brands' medium-size gloves."
disposable_gloves,https://www.amazon.com/dp/B07KYV178H,12/15/2020,Post_Covid,Zygster,1,,These gloves tear almost instantly. I just use them when for protection from Coronavirus. I use talcum powder before trying to put them on because otherwise they almost certainly will treat. Then within a minute or two they will to open between the fingers. They are total garbage
disposable_gloves,https://www.amazon.com/dp/B07KYV178H,4/18/2021,Post_Covid,Barbara Dees,3,,"These gloves tear apart easily if you are using them to do more than just wear. If you're looking for something more durable for applying or giving mediation to your animals as I do, or any other duties, stick to the blue gloves. I can probably use these for grocery or any other shopping I need to do, in which case they work for that just fine."
disposable_gloves,https://www.amazon.com/dp/B07KYV178H,12/6/2020,Post_Covid,anthony loffredo,1,,These gloves tear while putting on. Not heavy duty at all. Very disappointed.
disposable_gloves,https://www.amazon.com/dp/B07KYV178H,12/1/2020,Post_Covid,Clayton4t,2,,"These gloves were a replacement for the black gloves I typically use in the kitchen when I cook... however, since rubber gloves are hard to come by I switched to these. They tear very easily and are snugger than the other medium gloves I typically use."
